Profile,Behavior_Area_1,Behavior_Area_2,Behavior_Area_3,Behavior_Area_4,Strength,Weakness,Stress_Trigger,Breaking_point
Strategic Integrator,Expressive,Exploratory,Structured,Harmonizing,"Turns big ideas into a shared plan that people can understand and follow.","Can spend too much time combining ideas and keeping everyone aligned, which slows tough decisions.","Too many priorities from different people","Decision speed (keeps seeking alignment after it stops being useful)"
Structured Clarity Driver,Expressive,Exploratory,Structured,Direct,"Creates clarity early and turns unclear ideas into clear priorities and standards.","May end exploration too early and cause pushback if others feel pushed aside.","Unclear situations and slow agreement","Communication tone (can become too blunt)"
Adaptive Catalyst,Expressive,Exploratory,Fluid,Harmonizing,"Builds momentum through experimentation and social energy.","Follow-through can weaken when the excitement fades and there is no outside structure.","Rigid plans and blocked access","Consistency (starts many things but finishes unevenly)"
Rapid Experimenter,Expressive,Exploratory,Fluid,Direct,"Challenges assumptions quickly and turns uncertainty into learning through action.","Can create confusion if direction changes too often.","Slow decision cycles","Shared direction (frequent pivots make it hard for others to stay aligned)"
Momentum Builder,Expressive,Pragmatic,Structured,Harmonizing,"Creates steady progress through clear plans and support from others.","May choose safer options instead of bigger opportunities.","Low resources and low morale","Ambition (shrinks the goal to keep things stable)"
Operational Commander,Expressive,Pragmatic,Structured,Direct,"Performs well under pressure by setting priorities, assigning work, and enforcing standards.","Relationships can suffer if pressure turns into constant criticism.","Missed commitments","Patience (tolerance for differences drops quickly)"
Adaptive Stabilizer,Expressive,Pragmatic,Fluid,Harmonizing,"Keeps progress going during change through flexible coordination.","Can take on too much responsibility and end up absorbing other people's problems.","Last-minute changes and interpersonal conflict","Boundaries (overcommitting weakens consistency)"
Crisis Navigator,Expressive,Pragmatic,Fluid,Direct,"Cuts through chaos by identifying what matters most and adapting quickly.","Long-term systems can be neglected when urgency becomes the normal mode.","Red tape and slow escalation","Long-term planning (falls into constant emergency mode)"
Purpose-Led Planner,Reserved,Exploratory,Structured,Harmonizing,"Keeps long-term direction through disciplined planning connected to personal values.","Can delay action by spending too much time preparing.","Noisy inputs and constant context switching","Start energy (struggles to launch)"
Analytical Architect,Reserved,Exploratory,Structured,Direct,"Builds strong systems and frameworks that stand up to careful review.","If they do not explain their thinking clearly, others may misunderstand them.","Sloppy reasoning or vague definitions","Collaboration flow (pulls back instead of explaining ideas)"
Reflective Synthesizer,Reserved,Exploratory,Fluid,Harmonizing,"Connects very different ideas into clear insight without needing attention.","Lack of structure can stop good insight from becoming real results.","Tight deadlines and pressure to be overly specific","Shipping the work (keeps refining instead of finishing)"
Independent Pathfinder,Reserved,Exploratory,Fluid,Direct,"Explores difficult problems alone and learns quickly.","Working too independently can make teamwork harder.","Being closely controlled","Team predictability (pulls away into solo work)"
Steady Alignment Builder,Reserved,Pragmatic,Structured,Harmonizing,"Builds trust through reliability, consistency, and steady relationships.","May avoid difficult conversations for too long to keep the peace.","Interpersonal tension","Truth-telling (smooths things over until problems finally erupt)"
Quality Sentinel,Reserved,Pragmatic,Structured,Direct,"Protects standards and spots risks before things fail.","Too much scrutiny can slow progress.","Unclear ownership and sloppy execution","Speed (sacrifices momentum to gain certainty)"
Supportive Adapter,Reserved,Pragmatic,Fluid,Harmonizing,"Keeps things stable through calm responsiveness and quiet problem-solving.","Can fade into the background if they do not set their own priorities.","Unclear expectations","Personal priorities (their work gets pulled apart by other people's needs)"
Pragmatic Realist,Reserved,Pragmatic,Fluid,Direct,"Sees what will work right now and says it clearly.","May overlook inspiration and the need to repair relationships.","Emotionally driven decisions","Influence (tells the truth but does not bring others along)"